{
  "requestId": "DOC-REQ-025",
  "state": "cancelled",
  "document": {"docId": "d_2026-q3-okr", "title": "2026 Q3 OKR", "sourceName": "Q3 产品规划"},
  "requester": {"name": "张三"},
  "permission": {"label": "协作权限", "roleLabel": "协作者"},
  "requestReason": "希望加入协作，以补充 KR3 数据。",
  "requestedAtDisplay": "2026-07-16 11:00",
  "messageTimeDisplay": "刚刚"
}
